{
  "identity": {
    "case_id": "GOLD-02",
    "origin_case_id": "CANDIDATE-02",
    "status": "gold",
    "revision": 1,
    "approved_by_user": true,
    "category": "faithful_transform",
    "reviewed_at": "2026-08-30",
    "profile_revision_at_review": "round-1-review"
  },
  "task": {
    "base_operation": "TRANSFORM",
    "augmentation": "NONE",
    "genre": "legal_notice",
    "audience": "general_reader",
    "media": [
      "markdown"
    ],
    "components": [
      "TEXT"
    ],
    "request": "把条款改成普通读者能顺着读懂的中文，不增加法律结论"
  },
  "source": {
    "material_type": "text",
    "content": "许可证在客户付清全部到期费用后生效；如果客户在到期后 30 天内仍未付款，授权自动终止，但已经产生的付款义务不受影响。",
    "references": []
  },
  "semantics": {
    "source_atoms": [
      {
        "id": "ATOM-001",
        "source_locator": "分号前",
        "claim": "许可证在全部到期费用付清后生效",
        "provenance_type": "SOURCE"
      },
      {
        "id": "ATOM-002",
        "source_locator": "分号后条件句",
        "claim": "到期后 30 天仍未付款时授权自动终止",
        "provenance_type": "SOURCE"
      },
      {
        "id": "ATOM-003",
        "source_locator": "末尾例外",
        "claim": "已经产生的付款义务不受授权终止影响",
        "provenance_type": "SOURCE"
      }
    ],
    "background_atoms": [],
    "must_preserve": [
      "生效条件",
      "30 天期限",
      "授权自动终止",
      "付款义务继续存在"
    ],
    "must_not_invent": [
      "宽限期可以延长",
      "授权终止会免除欠款",
      "已经完成付款"
    ],
    "inference_atoms": []
  },
  "artifact": {
    "answer": "客户付清全部到期费用后，许可证才会生效；如果到期后 30 天仍未付款，授权会自动终止；授权终止不会免除已经产生的付款义务",
    "support_map": [
      {
        "sentence": 1,
        "supports": [
          "ATOM-001"
        ],
        "role": "source_restatement"
      },
      {
        "sentence": 2,
        "supports": [
          "ATOM-002"
        ],
        "role": "source_restatement"
      },
      {
        "sentence": 3,
        "supports": [
          "ATOM-003"
        ],
        "role": "source_restatement"
      }
    ],
    "self_claims": [],
    "original_case_sha256": "44c275bf884afec095cafc99719c727af8db170da42a7f081b64bcc84d00e42b",
    "approved_snapshot_sha256": "7e9a800e37e4d4592b5cf8fc10a8113bf33898391a4461f984591a4a4afa861f"
  },
  "review": {
    "decision_source": "explicit_user_review",
    "decision": "accepted",
    "reasons": [
      "完整保留原始事实并按照自然顺序表达"
    ],
    "correct_parts": [
      "压缩程度与解释深度合适"
    ],
    "regression_requirements": [],
    "privacy": {
      "status": "public_safe",
      "basis": "只保存脱敏后的技术判断，不包含原始对话、账户信息或个人路径"
    },
    "non_blocking_preferences": []
  }
}
